<?xml version="1.0" encoding="ISO-8859-1"?>
<!-- edited martin@yafra.org -->
<!DOCTYPE TRAVELDB SYSTEM "G:\work\cvswork\mapo\xml\tdb-cmd.dtd">
<TRAVELDB version="1.0">
	<STATUS>
		<CODE>0</CODE>
		<MSG>OK</MSG>
	</STATUS>
	<SQLCMD version="1.0">
		<OBJECT>250</OBJECT>
		<SQL>DELETE * FROM ROOT.SAISON</SQL>
		<NOROWS>3</NOROWS>
		<CRET>0</CRET>
	</SQLCMD>
</TRAVELDB>
